{"$id":"urn:hioc:pe4:ha-association-adapter-implementation:1.0","$schema":"https://json-schema.org/draft/2020-12/schema","additionalProperties":false,"properties":{"adapter_implementation":{"const":"PASS_CLOSED"},"authorities":{"additionalProperties":false,"properties":{"docs/HIOC_MASTER_PLAN.md":{"additionalProperties":false,"properties":{"git_blob":{"const":"1a311ad31438fffdbb5ed39f48934b0cb94de12f"},"path":{"const":"docs/HIOC_MASTER_PLAN.md"},"sha256":{"const":"b48d8804a497199312e751e5fcb2fd90bd4fa4287eef9740e035141aff8cbaee"}},"required":["git_blob","path","sha256"],"type":"object"},"docs/PE4_HOME_ASSISTANT_ASSOCIATION_ADAPTER_IMPLEMENTATION_PREPARATION.md":{"additionalProperties":false,"properties":{"git_blob":{"const":"d9ce2ee6e8c712f2dc4e20545b0e70dfa04cbe53"},"path":{"const":"docs/PE4_HOME_ASSISTANT_ASSOCIATION_ADAPTER_IMPLEMENTATION_PREPARATION.md"},"sha256":{"const":"973eca34ea3fd10baa3fed051e08dd70480fba7fe662dae68cbb4f21af41872f"}},"required":["git_blob","path","sha256"],"type":"object"},"docs/PE4_HOME_ASSISTANT_ASSOCIATION_CONTRACT.md":{"additionalProperties":false,"properties":{"git_blob":{"const":"6554cce77b011d075f66f7127aab7005f7aeee64"},"path":{"const":"docs/PE4_HOME_ASSISTANT_ASSOCIATION_CONTRACT.md"},"sha256":{"const":"80d5ed1cf0ff9e6bbf4cf8d7db703e1b7983a291ad8be0fe47d9222a12ddfdef"}},"required":["git_blob","path","sha256"],"type":"object"},"docs/PE4_HOME_ASSISTANT_ASSOCIATION_LIFECYCLE_CLARIFICATION.md":{"additionalProperties":false,"properties":{"git_blob":{"const":"09646a998b55f887a6f53d80f87eb496958f0f7c"},"path":{"const":"docs/PE4_HOME_ASSISTANT_ASSOCIATION_LIFECYCLE_CLARIFICATION.md"},"sha256":{"const":"78a3815c964951f285de7a8802dc4dd433661ee8985193da869144a66dfb18bb"}},"required":["git_blob","path","sha256"],"type":"object"},"docs/PE4_HOME_ASSISTANT_RUNTIME_CREDENTIAL_PROVISIONING.md":{"additionalProperties":false,"properties":{"git_blob":{"const":"57a5e8f0f9d9ff07524ec1e6d59003fd0cba3fa2"},"path":{"const":"docs/PE4_HOME_ASSISTANT_RUNTIME_CREDENTIAL_PROVISIONING.md"},"sha256":{"const":"bcfe32a70ac7b87d1cd3bf5e3bd985e2f36e58e3154730c03470a459665c7459"}},"required":["git_blob","path","sha256"],"type":"object"},"governance/compatibility-contracts.json":{"additionalProperties":false,"properties":{"git_blob":{"const":"84cb92f2cab8f51e6dbf7b1b7415d7e008eded9a"},"path":{"const":"governance/compatibility-contracts.json"},"sha256":{"const":"83493cacfef10ff85e936bcacbee215797c745e3fa6edff1954c3cc1f3c82227"}},"required":["git_blob","path","sha256"],"type":"object"},"governance/pe4/pe4-0c-association-contract.json":{"additionalProperties":false,"properties":{"git_blob":{"const":"744f1cf4b6b9c214720bc6e9c84656bc5efce973"},"path":{"const":"governance/pe4/pe4-0c-association-contract.json"},"sha256":{"const":"a48ec696c7e596dde68e252366f84ea46dfa7076a9b1aaff419a993742ed9a58"}},"required":["git_blob","path","sha256"],"type":"object"},"governance/pe4/pe4-0c1-association-lifecycle-clarification.json":{"additionalProperties":false,"properties":{"git_blob":{"const":"96b4be1185d3f61fd6e5d6914ef27f2d1dae762a"},"path":{"const":"governance/pe4/pe4-0c1-association-lifecycle-clarification.json"},"sha256":{"const":"de53307023af7c663878aa9e6212d27cf9023c372c69224bf4b186642c11fb0e"}},"required":["git_blob","path","sha256"],"type":"object"},"governance/pe4/pe4-ha-association-adapter-implementation-preparation.json":{"additionalProperties":false,"properties":{"git_blob":{"const":"7581ea89e40c5fb5b8eca60753b457eac2f4aa28"},"path":{"const":"governance/pe4/pe4-ha-association-adapter-implementation-preparation.json"},"sha256":{"const":"e014ce6a7b70db26f9d643318d93b8da9e6050afedbd09fe73e86e0efbd14d0b"}},"required":["git_blob","path","sha256"],"type":"object"},"governance/pe4/pe4-ha-runtime-credential-provisioning-closure.json":{"additionalProperties":false,"properties":{"git_blob":{"const":"4a4f15c50f4726a7518c77dd42080f0aea5bf078"},"path":{"const":"governance/pe4/pe4-ha-runtime-credential-provisioning-closure.json"},"sha256":{"const":"ae1aa575799576d7bdbd64670a516fdc1e38cb6c2b5b6fb816211e69987dde18"}},"required":["git_blob","path","sha256"],"type":"object"},"governance/pe4/pe4-home-assistant-association-state-v1.1.schema.json":{"additionalProperties":false,"properties":{"git_blob":{"const":"38c0235b86241caaaf0bc000117bf5635f8b3eb1"},"path":{"const":"governance/pe4/pe4-home-assistant-association-state-v1.1.schema.json"},"sha256":{"const":"5cd060ffd0a7a2e0a2b3e61da50ec8e5a418f4251df7305f713c10701b0e6a5d"}},"required":["git_blob","path","sha256"],"type":"object"}},"required":["docs/HIOC_MASTER_PLAN.md","docs/PE4_HOME_ASSISTANT_ASSOCIATION_ADAPTER_IMPLEMENTATION_PREPARATION.md","docs/PE4_HOME_ASSISTANT_ASSOCIATION_CONTRACT.md","docs/PE4_HOME_ASSISTANT_ASSOCIATION_LIFECYCLE_CLARIFICATION.md","docs/PE4_HOME_ASSISTANT_RUNTIME_CREDENTIAL_PROVISIONING.md","governance/compatibility-contracts.json","governance/pe4/pe4-0c-association-contract.json","governance/pe4/pe4-0c1-association-lifecycle-clarification.json","governance/pe4/pe4-ha-association-adapter-implementation-preparation.json","governance/pe4/pe4-ha-runtime-credential-provisioning-closure.json","governance/pe4/pe4-home-assistant-association-state-v1.1.schema.json"],"type":"object"},"automatic_association_basis":{"const":"UNIQUE_VALID_NONCOLLIDING_MAC"},"command_ids":{"const":[1,2,3,4],"items":{"type":"integer"},"maxItems":4,"minItems":4,"type":"array"},"commands":{"const":["config/device_registry/list","config/entity_registry/list","config/area_registry/list","config_entries/get"],"items":{"type":"string"},"maxItems":4,"minItems":4,"type":"array"},"compatibility":{"additionalProperties":false,"properties":{"assessment":{"const":"hioc.core.compatibility.assess"},"capabilities":{"const":["version_metadata","authentication","device_registry","entity_registry","area_registry","config_entries"],"items":{"type":"string"},"maxItems":6,"minItems":6,"type":"array"},"dependency_id":{"const":"ha_core"},"full_map":{"const":true},"reporting_after_association_commit":{"const":true},"writer":{"const":"hioc.core.compatibility.update_status"}},"required":["assessment","capabilities","dependency_id","full_map","reporting_after_association_commit","writer"],"type":"object"},"credential":{"additionalProperties":false,"properties":{"directory_mode":{"const":"0750"},"group":{"const":"jazofv1"},"mode":{"const":"0640"},"owner":{"const":"root"},"path":{"const":"/etc/hioc/credentials/home_assistant.token"},"read_count":{"const":1},"read_normalization":{"const":"REQUIRE_AND_REMOVE_EXACTLY_ONE_FINAL_LF_NO_TRIM"},"real_value_used":{"const":false},"stored_representation":{"const":"TOKEN_PLUS_EXACTLY_ONE_FINAL_LF"}},"required":["directory_mode","group","mode","owner","path","read_count","read_normalization","real_value_used","stored_representation"],"type":"object"},"deployment":{"const":"NOT_STARTED"},"documentation":{"const":"docs/PE4_HOME_ASSISTANT_ASSOCIATION_ADAPTER_IMPLEMENTATION.md"},"endpoint":{"additionalProperties":false,"properties":{"dns":{"const":false},"implicit_default":{"const":false},"key":{"const":"HIOC_HA_ENDPOINT"},"proxy":{"const":false},"redirect":{"const":false},"required":{"const":"ws://192.168.100.251:8123/api/websocket"},"retries":{"const":0},"source":{"const":"config/hioc.conf"}},"required":["dns","implicit_default","key","proxy","redirect","required","retries","source"],"type":"object"},"generic_integration_ingestion":{"const":"PROHIBITED"},"ha_access":{"const":false},"lock_path":{"const":"/home/jazofv1/hioc/state/inventory/associations/.home_assistant.lock"},"mqtt_association_publication":{"const":false},"network_validation":{"const":false},"next_checkpoint":{"const":"PE-4 Home Assistant Association Adapter Deployment Preparation"},"pe4":{"const":"NOT_COMPLETE"},"phase7a":{"const":"ACTIVE"},"pi3_access":{"const":false},"pi5_access":{"const":false},"private_state_path":{"const":"/home/jazofv1/hioc/state/inventory/associations/home_assistant.json"},"production_execution":{"const":false},"production_state_mutation":{"const":false},"public_projection":{"const":"DEFERRED"},"publication":{"additionalProperties":false,"properties":{"commit_point":{"const":"VERIFIED_DURABLE_COMMITTED_MARKER"},"done_namespace":{"const":"CLEANUP_ONLY_NEVER_RESTORE"},"history_eviction":{"const":false},"history_max":{"const":4096},"inventory_recheck":{"const":"EXACT_BYTES_AND_FRESHNESS"},"prior_backup":{"const":"EXACT_INODE_HARDLINK"}},"required":["commit_point","done_namespace","history_eviction","history_max","inventory_recheck","prior_backup"],"type":"object"},"real_credential_used":{"const":false},"record_type":{"const":"PE4_HA_ASSOCIATION_ADAPTER_IMPLEMENTATION"},"rollback":{"const":"NOT_PERFORMED"},"runtime":{"additionalProperties":false,"properties":{"architecture":{"const":"aarch64"},"environment":{"const":"/home/jazofv1/hioc/runtime/pe4/environments/cpython311-websockets16.1.1-lock-v1"},"flags":{"const":["-I","-B"],"items":{"type":"string"},"maxItems":2,"minItems":2,"type":"array"},"implementation":{"const":"cpython"},"interpreter":{"const":"/home/jazofv1/hioc/runtime/pe4/active/bin/python"},"new_dependencies":{"const":false},"python":{"const":"3.11.2"},"soabi":{"const":"cpython-311-aarch64-linux-gnu"},"websockets":{"const":"16.1.1"}},"required":["architecture","environment","flags","implementation","interpreter","new_dependencies","python","soabi","websockets"],"type":"object"},"scheduler_deployment":{"const":"NOT_STARTED"},"sources":{"additionalProperties":false,"properties":{"entrypoint":{"additionalProperties":false,"properties":{"git_blob":{"const":"2864361fac7cd48e947dac1e4e40aeeeb525adef"},"path":{"const":"pi4/bin/hioc-home-assistant-association.py"},"sha256":{"const":"005fae482a4e2c42b48bfb991abf14ddf1d9de60f81169a2ed1573a767958b8c"}},"required":["git_blob","path","sha256"],"type":"object"},"module":{"additionalProperties":false,"properties":{"git_blob":{"const":"9be8d80d423e09b26aa3ee0975d4edeb8f21a571"},"path":{"const":"pi4/lib/hioc/home_assistant_association.py"},"sha256":{"const":"45edba68808618fccee97c818d9dbe5234195771c30d8c4fe8656759bfa2f000"}},"required":["git_blob","path","sha256"],"type":"object"}},"required":["entrypoint","module"],"type":"object"},"starting_commit":{"const":"8923a074ac304a5cfe46367330819291caed6550"},"state_schema_version":{"const":"1.1"},"status":{"const":"PASS_CLOSED"},"validation":{"additionalProperties":false,"properties":{"focused_suite":{"const":"tests.test_pe4_ha_association_adapter"},"focused_tests":{"const":60},"kind":{"const":"WINDOWS_REPOSITORY_SYNTHETIC_ONLY"},"regression_counts":{"additionalProperties":false,"properties":{"adapter_preparation":{"const":13},"compatibility":{"const":40},"credential_closure":{"const":9},"credential_provisioning":{"const":44},"inventory":{"const":123},"master_plan":{"const":5},"pe4_0b2b_closure":{"const":3},"pe4_0c":{"const":14},"pe4_0c1":{"const":13},"release":{"const":11}},"required":["adapter_preparation","compatibility","credential_closure","credential_provisioning","inventory","master_plan","pe4_0b2b_closure","pe4_0c","pe4_0c1","release"],"type":"object"},"regression_suites":{"const":["tests.test_pe4_0c_association_contract","tests.test_pe4_0c1_association_lifecycle","tests.test_pe4_ha_association_implementation_preparation","tests.test_pe4_ha_runtime_credential_provisioning","tests.test_pe4_ha_runtime_credential_provisioning_closure","tests.test_pe4_0b2b_execution_closure","tests.test_compatibility_master_plan_governance","tests.test_inventory","tests.test_compatibility","tests.test_release"],"items":{"type":"string"},"maxItems":10,"minItems":10,"type":"array"},"release_skip":{"const":"POSIX rsync unavailable on Windows"},"total_passed":{"const":334},"total_run":{"const":335},"total_skipped":{"const":1}},"required":["focused_suite","focused_tests","kind","regression_counts","regression_suites","release_skip","total_passed","total_run","total_skipped"],"type":"object"}},"required":["adapter_implementation","authorities","automatic_association_basis","command_ids","commands","compatibility","credential","deployment","documentation","endpoint","generic_integration_ingestion","ha_access","lock_path","mqtt_association_publication","network_validation","next_checkpoint","pe4","phase7a","pi3_access","pi5_access","private_state_path","production_execution","production_state_mutation","public_projection","publication","real_credential_used","record_type","rollback","runtime","scheduler_deployment","sources","starting_commit","state_schema_version","status","validation"],"title":"Closed repository-only HA association adapter implementation","type":"object"}
