{"adapter_implementation":"PASS_CLOSED","authorities":{"docs/HIOC_MASTER_PLAN.md":{"git_blob":"1a311ad31438fffdbb5ed39f48934b0cb94de12f","path":"docs/HIOC_MASTER_PLAN.md","sha256":"b48d8804a497199312e751e5fcb2fd90bd4fa4287eef9740e035141aff8cbaee"},"docs/PE4_HOME_ASSISTANT_ASSOCIATION_ADAPTER_IMPLEMENTATION_PREPARATION.md":{"git_blob":"d9ce2ee6e8c712f2dc4e20545b0e70dfa04cbe53","path":"docs/PE4_HOME_ASSISTANT_ASSOCIATION_ADAPTER_IMPLEMENTATION_PREPARATION.md","sha256":"973eca34ea3fd10baa3fed051e08dd70480fba7fe662dae68cbb4f21af41872f"},"docs/PE4_HOME_ASSISTANT_ASSOCIATION_CONTRACT.md":{"git_blob":"6554cce77b011d075f66f7127aab7005f7aeee64","path":"docs/PE4_HOME_ASSISTANT_ASSOCIATION_CONTRACT.md","sha256":"80d5ed1cf0ff9e6bbf4cf8d7db703e1b7983a291ad8be0fe47d9222a12ddfdef"},"docs/PE4_HOME_ASSISTANT_ASSOCIATION_LIFECYCLE_CLARIFICATION.md":{"git_blob":"09646a998b55f887a6f53d80f87eb496958f0f7c","path":"docs/PE4_HOME_ASSISTANT_ASSOCIATION_LIFECYCLE_CLARIFICATION.md","sha256":"78a3815c964951f285de7a8802dc4dd433661ee8985193da869144a66dfb18bb"},"docs/PE4_HOME_ASSISTANT_RUNTIME_CREDENTIAL_PROVISIONING.md":{"git_blob":"57a5e8f0f9d9ff07524ec1e6d59003fd0cba3fa2","path":"docs/PE4_HOME_ASSISTANT_RUNTIME_CREDENTIAL_PROVISIONING.md","sha256":"bcfe32a70ac7b87d1cd3bf5e3bd985e2f36e58e3154730c03470a459665c7459"},"governance/compatibility-contracts.json":{"git_blob":"84cb92f2cab8f51e6dbf7b1b7415d7e008eded9a","path":"governance/compatibility-contracts.json","sha256":"83493cacfef10ff85e936bcacbee215797c745e3fa6edff1954c3cc1f3c82227"},"governance/pe4/pe4-0c-association-contract.json":{"git_blob":"744f1cf4b6b9c214720bc6e9c84656bc5efce973","path":"governance/pe4/pe4-0c-association-contract.json","sha256":"a48ec696c7e596dde68e252366f84ea46dfa7076a9b1aaff419a993742ed9a58"},"governance/pe4/pe4-0c1-association-lifecycle-clarification.json":{"git_blob":"96b4be1185d3f61fd6e5d6914ef27f2d1dae762a","path":"governance/pe4/pe4-0c1-association-lifecycle-clarification.json","sha256":"de53307023af7c663878aa9e6212d27cf9023c372c69224bf4b186642c11fb0e"},"governance/pe4/pe4-ha-association-adapter-implementation-preparation.json":{"git_blob":"7581ea89e40c5fb5b8eca60753b457eac2f4aa28","path":"governance/pe4/pe4-ha-association-adapter-implementation-preparation.json","sha256":"e014ce6a7b70db26f9d643318d93b8da9e6050afedbd09fe73e86e0efbd14d0b"},"governance/pe4/pe4-ha-runtime-credential-provisioning-closure.json":{"git_blob":"4a4f15c50f4726a7518c77dd42080f0aea5bf078","path":"governance/pe4/pe4-ha-runtime-credential-provisioning-closure.json","sha256":"ae1aa575799576d7bdbd64670a516fdc1e38cb6c2b5b6fb816211e69987dde18"},"governance/pe4/pe4-home-assistant-association-state-v1.1.schema.json":{"git_blob":"38c0235b86241caaaf0bc000117bf5635f8b3eb1","path":"governance/pe4/pe4-home-assistant-association-state-v1.1.schema.json","sha256":"5cd060ffd0a7a2e0a2b3e61da50ec8e5a418f4251df7305f713c10701b0e6a5d"}},"automatic_association_basis":"UNIQUE_VALID_NONCOLLIDING_MAC","command_ids":[1,2,3,4],"commands":["config/device_registry/list","config/entity_registry/list","config/area_registry/list","config_entries/get"],"compatibility":{"assessment":"hioc.core.compatibility.assess","capabilities":["version_metadata","authentication","device_registry","entity_registry","area_registry","config_entries"],"dependency_id":"ha_core","full_map":true,"reporting_after_association_commit":true,"writer":"hioc.core.compatibility.update_status"},"credential":{"directory_mode":"0750","group":"jazofv1","mode":"0640","owner":"root","path":"/etc/hioc/credentials/home_assistant.token","read_count":1,"read_normalization":"REQUIRE_AND_REMOVE_EXACTLY_ONE_FINAL_LF_NO_TRIM","real_value_used":false,"stored_representation":"TOKEN_PLUS_EXACTLY_ONE_FINAL_LF"},"deployment":"NOT_STARTED","documentation":"docs/PE4_HOME_ASSISTANT_ASSOCIATION_ADAPTER_IMPLEMENTATION.md","endpoint":{"dns":false,"implicit_default":false,"key":"HIOC_HA_ENDPOINT","proxy":false,"redirect":false,"required":"ws://192.168.100.251:8123/api/websocket","retries":0,"source":"config/hioc.conf"},"generic_integration_ingestion":"PROHIBITED","ha_access":false,"lock_path":"/home/jazofv1/hioc/state/inventory/associations/.home_assistant.lock","mqtt_association_publication":false,"network_validation":false,"next_checkpoint":"PE-4 Home Assistant Association Adapter Deployment Preparation","pe4":"NOT_COMPLETE","phase7a":"ACTIVE","pi3_access":false,"pi5_access":false,"private_state_path":"/home/jazofv1/hioc/state/inventory/associations/home_assistant.json","production_execution":false,"production_state_mutation":false,"public_projection":"DEFERRED","publication":{"commit_point":"VERIFIED_DURABLE_COMMITTED_MARKER","done_namespace":"CLEANUP_ONLY_NEVER_RESTORE","history_eviction":false,"history_max":4096,"inventory_recheck":"EXACT_BYTES_AND_FRESHNESS","prior_backup":"EXACT_INODE_HARDLINK"},"real_credential_used":false,"record_type":"PE4_HA_ASSOCIATION_ADAPTER_IMPLEMENTATION","rollback":"NOT_PERFORMED","runtime":{"architecture":"aarch64","environment":"/home/jazofv1/hioc/runtime/pe4/environments/cpython311-websockets16.1.1-lock-v1","flags":["-I","-B"],"implementation":"cpython","interpreter":"/home/jazofv1/hioc/runtime/pe4/active/bin/python","new_dependencies":false,"python":"3.11.2","soabi":"cpython-311-aarch64-linux-gnu","websockets":"16.1.1"},"scheduler_deployment":"NOT_STARTED","sources":{"entrypoint":{"git_blob":"2864361fac7cd48e947dac1e4e40aeeeb525adef","path":"pi4/bin/hioc-home-assistant-association.py","sha256":"005fae482a4e2c42b48bfb991abf14ddf1d9de60f81169a2ed1573a767958b8c"},"module":{"git_blob":"9be8d80d423e09b26aa3ee0975d4edeb8f21a571","path":"pi4/lib/hioc/home_assistant_association.py","sha256":"45edba68808618fccee97c818d9dbe5234195771c30d8c4fe8656759bfa2f000"}},"starting_commit":"8923a074ac304a5cfe46367330819291caed6550","state_schema_version":"1.1","status":"PASS_CLOSED","validation":{"focused_suite":"tests.test_pe4_ha_association_adapter","focused_tests":60,"kind":"WINDOWS_REPOSITORY_SYNTHETIC_ONLY","regression_counts":{"adapter_preparation":13,"compatibility":40,"credential_closure":9,"credential_provisioning":44,"inventory":123,"master_plan":5,"pe4_0b2b_closure":3,"pe4_0c":14,"pe4_0c1":13,"release":11},"regression_suites":["tests.test_pe4_0c_association_contract","tests.test_pe4_0c1_association_lifecycle","tests.test_pe4_ha_association_implementation_preparation","tests.test_pe4_ha_runtime_credential_provisioning","tests.test_pe4_ha_runtime_credential_provisioning_closure","tests.test_pe4_0b2b_execution_closure","tests.test_compatibility_master_plan_governance","tests.test_inventory","tests.test_compatibility","tests.test_release"],"release_skip":"POSIX rsync unavailable on Windows","total_passed":334,"total_run":335,"total_skipped":1}}
